### ISSUE TITLE
Adoption Failed

### ISSUE THREAD

**Issue by NS-K** [wvengen/unifi-controllable-switch#4]
Just tried your port but it always end with adoption failed

**Comment by wvengen** [comment]
If you've changed the username/password, you may need to provide the: after adoption failed, an _Adopt_ tab appears for the device in the UniFi controller where you can provide these details.

If that also fails, you could check to see if configuration files are present on the switch in `cfg/` - most importantly, authkey and inform_url. You could also try killing `unifi-daemon` and starting it manually, to see if that works.

**Comment by wvengen** [comment]
To debug more, you could set debug loglevel in the UniFi controller (in settings, or see [here](https://github.com/wvengen/unifi-controllable-switch/blob/master/README_DEVEL.md#unifi-controller-log-level)), and look in the controller logfile to see what exactly fails.

**Comment by NS-K** [comment]
_cfg file : 

inform_url=http://192.168.3.44:8080/inform
authkey=*************

Logfile : 

[2017-01-16 10:41:11,131] <check-network-interfaces> DEBUG system - Interfaces: [{ "ip" : "192.168.3.44" , "name" : "en0"}]
[2017-01-16 10:41:15,063] <inform-70> DEBUG inform - dev[24-A4-3C-XX-XX-XX] inform decrypt error

**Comment by wvengen** [comment]
Thanks! You may not want to post your `authkey`, it's an encryption key.
So the adoption procedure does seem to have worked, the subsequent inform call doesn't, though.
What UniFi controller version are you using? Does restarting `unifi-daemon` (on switch) do anything?

**Comment by NS-K** [comment]
it's just a lab network so don't worry about the key.
i ve tried with both 5.3.8 and 5.3.9.

**Comment by wvengen** [comment]
Hmm that should work.
What about completely forgetting the device, and retrying adoption? Sometimes I've seen issues like this disappear when doing that.
Next step in debugging this would be to try this with the scripts from `devel/` it it works at all for you. Enter mac, ip, authkey, inform_url in `unifi_config.py`, and run the inform script. See if that works at all.

I've used this succesfully for a couple of weeks now, but I can imagine that slightly other setups may almost work, but not quite. If you have time to debug, I'd be happy to integrate whatever changes needed.

**Comment by off14** [comment]
same issue - adoption always failed.
BTW before press adopt - no option to put login/pasword

**Comment by wvengen** [comment]
@off14 Sorry to hear. The only option is to dig into what happens. What do the controller logs say, also _inform decrypt error_? In that case, ssh works. Is the authkey on the device correct (with the correct log settings on the controller, this is emitted so you can compare)? Does running the tools in `devel/` work at all? I'm afraid it requires some digging to figure out what it is. I'm not seeing any problems with my setups, so it's hard to debug for me.
The UniFi controller only shows the option to put login/password after a failed adoption attempt

**Comment by off14** [comment]
ssh to switch works, log has nothing specific.
where auth key on the switch is located? unifi daemon on switch is running

unifi log shows:
[2017-02-22 13:56:46,816] <devmgr> INFO  dev    -    [state] dev[04:18:d6:f1:a7:fd] INFORM_ERROR->UNKNOWN, state_expire=0

**Comment by wvengen** [comment]
In `/var/etc/persistent/cfg` or `/tmp/unifi-cfg`, file `_cfg`.
I assume you've read [README_DEVEL.md](https://github.com/wvengen/unifi-controllable-switch/blob/master/README_DEVEL.md#unifi-controller-log-level).

**Comment by off14** [comment]
i've removed "forget" switched from unifi controller and now can't get it back. how to do this?
config on switch looks like this:


SW.v1.3.3# cat cfg/_cfg
inform_url=http://192.168.1.156:8080/inform
authkey=e74b29015977ac7eb4ef23bb9cba4a34

**Comment by wvengen** [comment]
@off14 I'm not sure if I understand you correctly, perhaps you mean that you pressed _forget_ (after adoption failed), and are expecting to see the device re-appearing in the controller? That may take a number of minutes to happen. If it doesn't happen yet, you could reboot the switch and see what happens. If that doesn't work either, ssh into the switch, run `rm -f /var/etc/persistent/cfg/*` (perhaps reboot though that shouldn't be needed).
Does that allow you to re-adopt the switch?

**Comment by off14** [comment]
you've understood me absolutely right.
will try now, thanks.

**Comment by off14** [comment]
i think something wrong with the switch now - tried to reboot and even to upload/update firmware again.
i am running tcpdump on the host(192.168.1.10 in my case) with controller and don't see any packets coming from switch ipaddress (192.168.1.249 in my case)

**Comment by off14** [comment]
still empty on the controller side. do you know where controller stores "forgotten" devices?

**Comment by off14** [comment]
tcpdump from controller (192.168.1.249 is a switch)


18:55:04.202840 IP 192.168.1.249.40201 > 192.168.1.156.8080: Flags [S], seq 1311601561, win 5840, options [mss 1460,sackOK,TS val 10619693 ecr 0,nop,wscale 1], length 0
18:55:04.202992 IP 192.168.1.156.8080 > 192.168.1.249.40201: Flags [S.], seq 2245422703, ack 1311601562, win 28960, options [mss 1460,sackOK,TS val 10620 ecr 10619693,nop,wscale 7], length 0
18:55:04.203379 IP 192.168.1.249.40201 > 192.168.1.156.8080: Flags [.], ack 1, win 2920, options [nop,nop,TS val 10619694 ecr 10620], length 0
18:55:04.205099 IP 192.168.1.249.40201 > 192.168.1.156.8080: Flags [P.], seq 1:141, ack 1, win 2920, options [nop,nop,TS val 10619696 ecr 10620], length 140: HTTP: POST http://192.168.1.156:8080/inform HTTP/1.0
18:55:04.205198 IP 192.168.1.156.8080 > 192.168.1.249.40201: Flags [.], ack 141, win 235, options [nop,nop,TS val 10620 ecr 10619696], length 0
18:55:04.215192 IP 192.168.1.249.40201 > 192.168.1.156.8080: Flags [P.], seq 141:165, ack 1, win 2920, options [nop,nop,TS val 10619706 ecr 10620], length 24: HTTP
18:55:04.215271 IP 192.168.1.156.8080 > 192.168.1.249.40201: Flags [.], ack 165, win 235, options [nop,nop,TS val 10621 ecr 10619706], length 0
18:55:04.219840 IP 192.168.1.249.40201 > 192.168.1.156.8080: Flags [.], seq 165:1613, ack 1, win 2920, options [nop,nop,TS val 10619710 ecr 10621], length 1448: HTTP
18:55:04.219930 IP 192.168.1.156.8080 > 192.168.1.249.40201: Flags [.], ack 1613, win 258, options [nop,nop,TS val 10622 ecr 10619710], length 0
18:55:04.219844 IP 192.168.1.249.40201 > 192.168.1.156.8080: Flags [P.], seq 1613:2365, ack 1, win 2920, options [nop,nop,TS val 10619710 ecr 10621], length 752: HTTP
18:55:04.220045 IP 192.168.1.156.8080 > 192.168.1.249.40201: Flags [.], ack 2365, win 280, options [nop,nop,TS val 10622 ecr 10619710], length 0
18:55:04.220153 IP 192.168.1.249.40201 > 192.168.1.156.8080: Flags [F.], seq 2365, ack 1, win 2920, options [nop,nop,TS val 10619711 ecr 10621], length 0
18:55:04.257598 IP 192.168.1.156.8080 > 192.168.1.249.40201: Flags [.], ack 2366, win 280, options [nop,nop,TS val 10626 ecr 10619711], length 0
18:55:04.344759 IP 192.168.1.156.8080 > 192.168.1.249.40201: Flags [P.], seq 1:129, ack 2366, win 280, options [nop,nop,TS val 10634 ecr 10619711], length 128: HTTP: HTTP/1.1 404 Not Found
18:55:04.345116 IP 192.168.1.249.40201 > 192.168.1.156.8080: Flags [.], ack 129, win 2920, options [nop,nop,TS val 10619836 ecr 10634], length 0
18:55:04.346249 IP 192.168.1.156.8080 > 192.168.1.249.40201: Flags [F.], seq 129, ack 2366, win 280, options [nop,nop,TS val 10634 ecr 10619836], length 0
18:55:04.346604 IP 192.168.1.249.40201 > 192.168.1.156.8080: Flags [.], ack 130, win 2920, options [nop,nop,TS val 10619837 ecr 10634], length 0

**Comment by off14** [comment]
root@raspberrypi: tail /var/log/unifi/server.log -n 2900 | grep a7:fd
[2017-02-27 15:52:43,991] <discover> INFO  event  - [event] Switch[04:18:d6:f1:a7:fd] was discovered and waiting for adoption
root@raspberrypi:~#

last message about the switch

**Comment by wvengen** [comment]
@off14 it seems like the switch still tries to inform the controller. Rebooting the switch was supposed to fix this, or else certainly removing the temporarily files (and rebooting again, though that might not be needed).
Can you verify the configuration files are gone on the switch?

p.s. shall we move this to a different issue, since this is about re-adoption while the original issue is about adoption failing. Copying the relevant bits would be useful (which I'll remove here then).

**Comment by off14** [comment]
[2017-02-27 19:48:12,301] <webapi-47> INFO  dev    -    [state] dev[04:18:d6:f1:a7:fd] ADOPT_FAILED->ADOPTING, state_expire=1488206922
[2017-02-27 19:48:12,310] <webapi-47> WARN  dev    -    [Try advAdopt] Removing host key and fingerprint for 04:18:d6:f1:a7:fd
[2017-02-27 19:48:12,316] <webapi-47> INFO  dev    -    [Try AdvAdopt] dev[04:18:d6:f1:a7:fd], ssh-adopt 192.168.1.249:22, url=http://192.168.1.156:8080/inform
[2017-02-27 19:48:26,678] <ssh> INFO  event  - [event] Switch[04:18:d6:f1:a7:fd] was automatically readopted
[2017-02-27 19:48:26,684] <ssh> INFO  dev    - saveDeviceAttr(): device[04:18:d6:f1:a7:fd][x_ssh_hostkey]=MIGhMA0GCSqGSIb3DQEBAQUAA4GPADCBiwKBgwCX6u4FI2XdAYvAzx0T5o/zU0J5trVZ/JSw37r4gJrm/TSTQpxZx7uQNsvULA+1ViCwO0+2FsOf1y01TWI1oIgaCFoJvEscLIBQwm+Of0vmJzPp3bFXVpV5o0T2HXy9I8ZjN2NrsVB8GImX+f55+uD8FtN2Q3TAJSIaRZ3sXz0uz8T7AgMBAAE= (orig=null)
[2017-02-27 19:48:26,714] <ssh> INFO  dev    - saveDeviceAttr(): device[04:18:d6:f1:a7:fd][x_ssh_hostkey_fingerprint]=87:2b:8b:7a:b5:5b:62:8e:60:c8:c6:c8:0c:b1:f2:7b (orig=null)

**Comment by off14** [comment]
now i get this from controller.
trying to re-adopt and removed checkbox "check ssh key"

**Comment by off14** [comment]
[2017-02-27 19:48:26,714] <ssh> INFO  dev    - saveDeviceAttr(): device[04:18:d6:f1:a7:fd][x_ssh_hostkey_fingerprint]=87:2b:8b:7a:b5:5b:62:8e:60:c8:c6:c8:0c:b1:f2:7b (orig=null)
[2017-02-27 19:49:28,001] <devmgr> INFO  dev    -    [state] dev[04:18:d6:f1:a7:fd] ADOPTING->UNKNOWN, state_expire=0
[2017-02-27 19:49:34,022] <inform-182> INFO  dev    -    [state] dev[04:18:d6:f1:a7:fd] UNKNOWN->INFORM_ERROR, state_expire=0

**Comment by off14** [comment]
controller says switch was last seen 14 minutes ago. strange behaovoir

**Comment by off14** [comment]
and after removing _cfg from switch, and adopt from controller, _cfg appears at switch again.
seems that daemon in switch is not sending any confirmation or any other packets

**Comment by off14** [comment]
20:04:36.200612 IP 192.168.1.10.8080 > 192.168.1.249.37956: Flags [P.], seq 1:129, ack 2364, win 280, options [nop,nop,TS val 427820 ecr 14791534], length 128: HTTP: HTTP/1.1 404 Not Found

seems that unifi 5.4.11 is not compatible with patched firmware

**Comment by off14** [comment]
# returns whether inform_url and authkey are present
can_inform() {
  cfg_get _cfg inform_url >/dev/null &&
    cfg_get _cfg authkey >/dev/null
}

what is cfg_get ? switch does not have this command

**Comment by wvengen** [comment]
@off14 `cfg_get` is defined in [`common.sh`](https://github.com/wvengen/unifi-controllable-switch/blob/master/src/shinc/common.sh#L30).
I think I'm running 5.4.10 now without a problem, haven't tested 5.4.11 yet. I don't recall the returned http status when the authkey is wrong, though.
**edit** I'm using 5.4.11 (upgraded, am not able to test the adoption process).

**Comment by Rudisorglos** [comment]
I have same thing. So the switch has an uptime of 1 second an was last seen 13 min ago. Time is not going on any more. still 13 min ago. @wvengen may I get the firmware you are using?

**Comment by Rudisorglos** [comment]
looks like this:
![controller](https://cloud.githubusercontent.com/assets/27234159/25023108/e7a0afc6-2098-11e7-9503-97668beb138a.jpg)
adopt is trying for a minute an after that failed

**Comment by wvengen** [comment]
In case you want to look into this further, the following can help:
* SSH into the switch, check config files in `cfg/` or `/tmp/unifi-cfg`.
  * no files exist when fresh
  * after adoption attempt, `inform_url` and `authkey` are set in `_cfg`
  * after adoption success, other files will contain complete configuration
  * you can try removing the directory, and restarting the `unifi-daemon` process
* Kill the `unifi-daemon` process and run it manually in the foreground. You might see messages.
* Add `set -x` on top of shell scripts you're calling to see what is happening.
* Run commands from [`unifi-daemon`](https://github.com/wvengen/unifi-controllable-switch/blob/master/src/unifi-daemon) manually to have more control over timing.
* Check logs on UniFi Controller ([more info](https://github.com/wvengen/unifi-controllable-switch/blob/master/README_DEVEL.md#unifi-controller-log-level)).
* Capture network traffic (`tcpdump` &amp; friends) to check requests and responses.
* Try simulating a switch using the [Python scripts](https://github.com/wvengen/unifi-controllable-switch/blob/master/README_DEVEL.md#python-scripts) to see if the process works at all for your setup (run from local computer).

**Comment by Rudisorglos** [comment]
Thanks for the List
on the switch are no cfg/ or /tmp/unifi-cfg even after tryed adopt. I found nothing about authkey. If the switch ist on 192.168.1.20 it is unreachable in unifi log an after ip in 192.168.2.x from tough web settings the unifi log says "INFORM_ERROR->ADOPTING, state_expire=1492198117" and is not longer seen in unifi controller. May it be, that your unifi controller is in a 192.168.1.x subnet? I give up...I'm not able to find logs in the switch from ssh an can't start the daemon manually. Thanks a lot.

**Comment by r3pek** [comment]
Hi all!

I have the exact same problem with version 1.3.5 of the switch firmware (controller on 5.4.16).

I used tcpdump on the switch to capture the traffic while adopting and have it available if @wvengen find it needed.
Strange thing was, after analysing it, the inform URL is returning 404 after the adopt fail, leaving unifi-daemon printing just this:
```
error: wrong magic
EXPECTED value GOT EOF
```
Looking at the code it's clear that it expected "TNBU" on the first 4 bytes of the reply but since it's just a 404 it get's nothing in return. Maybe something chantged on the adopting phase with the controller?

btw, I also don't have any cfg/ or /tmp/unifi-cfg directories.

**Comment by i3laze** [comment]
```
SW.v1.3.5# sudo ./unifi-daemon 
./unifi-daemon: line 41: ./unifi-inform-data: Permission denied

SW.v1.3.5# ls /usr/unifi/ -l
drwxr-xr-x    2 ubnt     admin          47 Oct 20 12:25 shinc
-rwxr-xr-x    1 ubnt     admin         733 Apr 24 20:24 syswrapper.sh
-rwxr-xr-x    1 ubnt     admin        1463 Apr 24 20:24 unifi-announce-data
-rwxr-xr-x    1 ubnt     admin         899 Apr 24 20:24 unifi-daemon
-rw-r--r--    1 ubnt     admin       10824 Oct 19 19:36 unifi-inform-data
-rwxr-xr-x    1 ubnt     admin         862 Apr 24 20:24 unifi-inform-process
-rwxr-xr-x    1 ubnt     admin         629 Apr 24 20:24 unifi-inform-send
-rwxr-xr-x    1 ubnt     admin        5557 Apr 24 20:24 unifi-inform-status
```

**Comment by off14** [comment]
same problem - after pressing "adopt" on unifi controller, i have the following messages from unifi-daemon:
SW.v1.3.5# ./unifi-daemon

error: wrong magic
EXPECTED value GOT EOF
